{
  "$schema": "../../../../Framework/Schemas/level.schema.json",
  "name": "street",
  "model": "Street/street.glb",
  "collision": "Street/street_col.glb",
  "chunks": [
    { "name": "west", "model": "Street/street_west.glb" },
    { "name": "centre", "model": "Street/street_centre.glb" },
    { "name": "east", "model": "Street/street_east.glb" }
  ],
  "defaultSpawn": "east_end",
  "spawns": {
    "east_end":    { "position": [36.0, 0.0, 1.0], "yaw": -90 },
    "from_shrine": { "position": [-14.0, 0.0, 12.6], "yaw": 0 },
    "from_house":  { "position": [34.3, 0.0, -3.2], "yaw": 180 },
    "from_fields": { "position": [-37.5, 0.0, 0.0], "yaw": 90 },
    "from_bus":    { "position": [38.0, 0.0, -3.0], "yaw": -90 }
  },
  "lighting": {
    "sunDirection": [0.35, 0.6, -0.55],
    "sunColor": [0.45, 0.45, 0.45],
    "skyColor": [0.75, 0.77, 0.80],
    "groundColor": [0.20, 0.19, 0.17],
    "fogColor": [0.46, 0.47, 0.47],
    "shadows": true
  },
  "outdoor": true,
  "audio": {
    "beds": [
      { "sound": "wind", "gain": 0.55 },
      { "sound": "cicadas", "gain": 0.18 },
      { "sound": "drone", "gain": 0.16 }
    ],
    "emitters": [
      { "sound": "vending_hum", "group": "vending", "position": [-20.0, 1.0, -4.1], "gain": 0.22, "minDistance": 1.5, "maxDistance": 14 },
      { "sound": "vending_hum", "group": "vending", "position": [29.8, 1.0, -4.1], "gain": 0.22, "minDistance": 1.5, "maxDistance": 14 },
      { "sound": "vending_hum", "group": "vending", "position": [-2.6, 1.0, 4.1], "gain": 0.22, "minDistance": 1.5, "maxDistance": 14 }
    ]
  },
  "surfaces": {
    "default": "dirt",
    "zones": [
      { "min": [-14.8, 0, 4.9], "max": [-13.2, 0, 10.3], "surface": "stone" },
      { "min": [-60, 0, -3.0], "max": [60, 0, 3.0], "surface": "asphalt" },
      { "min": [-60, 0, -3.65], "max": [60, 0, 3.65], "surface": "concrete" }
    ]
  },
  "particles": { "leaves": true, "fogBanks": true },
  "unease": {
    "figure": true,
    "figureSpots": [
      [-36.0, 0.0, 0.8], [-30.0, 0.0, -4.0], [-15.0, 0.0, 15.8],
      [24.0, 0.0, 12.0], [6.0, 0.0, 4.2], [38.0, 0.0, -1.2]
    ],
    "flickerMaterial": "atom_vending_front",
    "flickerSites": [[-20.0, 0.0, -4.1], [29.8, 0.0, -4.1], [-2.6, 0.0, 4.1]]
  },
  "sequences": {
    "bus_to_city": [
      { "type": "message", "text": "You sit on the bench to wait. Past the last house the road runs on into the fog." },
      { "type": "wait", "seconds": 3 },
      { "type": "show", "entity": "bus" },
      { "type": "playSound", "sound": "bus_engine", "entity": "bus", "gain": 0.8, "loop": true },
      { "type": "moveEntity", "entity": "bus", "to": [42.5, 0.0, -1.7], "seconds": 8 },
      { "type": "playAnimation", "entity": "bus", "clip": "doors_open" },
      { "type": "playSound", "sound": "door_hiss", "entity": "bus", "gain": 0.9 },
      { "type": "message", "text": "Headlights. The bus stops with a sigh of air and the doors fold open. Nobody gets off." },
      { "type": "wait", "seconds": 2.5 },
      { "type": "message", "text": "You climb aboard. The driver doesn't look up." },
      { "type": "setFlag", "flag": "rode_bus_to_city" },
      { "type": "wait", "seconds": 1 },
      { "type": "changeLevel", "level": "night_street", "spawn": "from_bus" }
    ]
  },
  "halos": [
    { "position": [-5.3, 0.8, -0.85], "size": 1.8, "color": [1.0, 0.92, 0.75], "intensity": 0.7, "entity": "bus" },
    { "position": [-5.3, 0.8, 0.85], "size": 1.8, "color": [1.0, 0.92, 0.75], "intensity": 0.7, "entity": "bus" }
  ],
  "lights": [
    { "position": [-7.0, 1.2, 0.0], "color": [1.0, 0.92, 0.8], "intensity": 1.4, "radius": 16.0, "entity": "bus" }
  ],
  "entities": [
    {
      "name": "bus_stop",
      "position": [39.3, 0.0, -5.0],
      "model": "Kit/bus_stop.glb",
      "collider": { "center": [0.0, 1.2, -0.5], "halfExtents": [1.6, 1.2, 0.1] },
      "interactable": {
        "prompt": "Wait for the bus", "focus": [0.0, 1.0, 0.1], "radius": 2.6,
        "action": { "type": "sequence", "id": "bus_to_city" }
      }
    },
    { "name": "bus", "position": [160.0, 0.0, -1.7], "model": "Kit/bus.glb", "hidden": true },
    {
      "name": "field_path",
      "position": [-40.0, 0.0, -1.5],
      "interactable": {
        "prompt": "Take the path to the fields", "focus": [0.0, 1.0, 0.0], "radius": 3.0,
        "action": { "type": "changeLevel", "level": "windmill_field", "spawn": "from_street" }
      }
    },
    {
      "name": "vending_machine_west",
      "position": [-20.0, 0.0, -4.1],
      "interactable": {
        "prompt": "Buy a drink", "focus": [0.0, 1.1, 0.45],
        "action": { "type": "message", "text": "The coin drops. Something rattles inside... nothing comes out." }
      }
    },
    {
      "name": "vending_machine_east",
      "position": [29.8, 0.0, -4.1],
      "interactable": {
        "prompt": "Buy a drink", "focus": [0.0, 1.1, 0.45],
        "action": { "type": "message", "text": "The coin drops. Something rattles inside... nothing comes out." }
      }
    },
    {
      "name": "vending_machine_south",
      "position": [-2.6, 0.0, 4.1],
      "interactable": {
        "prompt": "Buy a drink", "focus": [0.0, 1.1, -0.45],
        "action": { "type": "message", "text": "The coin drops. Something rattles inside... nothing comes out." }
      }
    },
    {
      "name": "torii",
      "position": [-14.0, 0.0, 5.5],
      "interactable": {
        "prompt": "Bow", "focus": [0.0, 1.6, 0.0], "radius": 2.5,
        "action": { "type": "setFlag", "flag": "bowed_at_torii", "message": "You bow before passing beneath the torii." }
      }
    },
    {
      "name": "hokora",
      "position": [-14.0, 0.0, 11.0],
      "interactable": {
        "prompt": "Pray", "focus": [0.0, 1.0, -0.7],
        "requires": "bowed_at_torii",
        "action": { "type": "setFlag", "flag": "prayed_at_hokora", "message": "You put your hands together. For a moment, the cicadas fall silent." },
        "locked": { "type": "message", "text": "It feels wrong to come this close without bowing at the torii first." }
      }
    },
    {
      "name": "shrine_gate",
      "position": [-14.0, 0.0, 13.8],
      "interactable": {
        "prompt": "Enter the shrine grounds", "focus": [0.0, 1.4, -0.35],
        "requires": "keeper_permission",
        "action": { "type": "changeLevel", "level": "shrine_grounds", "spawn": "gate" },
        "locked": { "type": "message", "text": "The gate is barred from the inside. Someone would have to let you in." }
      }
    },
    {
      "name": "house_door",
      "position": [34.3, 0.0, -4.4],
      "interactable": {
        "prompt": "Enter the house", "focus": [0.0, 1.2, 0.15],
        "action": { "type": "changeLevel", "level": "machiya_interior", "spawn": "entrance" }
      }
    },
    {
      "name": "shrine_keeper",
      "position": [-11.4, 0.0, 3.9],
      "yaw": 180,
      "model": "Kit/keeper.glb",
      "collider": { "center": [0.0, 0.85, 0.0], "halfExtents": [0.3, 0.85, 0.25] },
      "interactable": {
        "prompt": "Talk", "focus": [0.0, 1.45, 0.0], "radius": 2.6,
        "action": { "type": "dialogue", "id": "shrine_keeper" }
      }
    }
  ]
}
