{
  "$schema": "../Schemas/level.schema.json",
  "name": "night_test",
  "model": "Fields/fields.glb",
  "collision": "Fields/fields_col.glb",
  "chunks": [
    { "name": "mid_blocks", "model": "City/mid_blocks.glb", "layer": "mid" },
    { "name": "skyline", "model": "City/skyline.glb", "layer": "far" }
  ],
  "impostors": [
    { "set": "City/tower_impostor.json", "position": [120.0, 0.0, 20.0], "yaw": 90 },
    { "set": "City/tower_impostor.json", "position": [100.0, 0.0, -80.0], "yaw": 30 },
    { "set": "City/tower_impostor.json", "position": [-30.0, 0.0, -130.0], "yaw": 0 },
    { "set": "City/tower_impostor.json", "position": [-110.0, 0.0, -60.0], "yaw": 200 },
    { "set": "City/tower_impostor.json", "position": [-125.0, 0.0, 40.0], "yaw": 270 },
    { "set": "City/tower_impostor.json", "position": [-40.0, 0.0, 120.0], "yaw": 160 },
    { "set": "City/tower_impostor.json", "position": [70.0, 0.0, 110.0], "yaw": 45 },
    { "set": "City/tower_impostor.json", "position": [140.0, 0.0, -20.0], "yaw": 120 }
  ],
  "defaultSpawn": "start",
  "spawns": {
    "start": { "position": [0.0, 0.0, 18.0], "yaw": 0 }
  },
  "lighting": {
    "sunDirection": [0.0, 1.0, 0.0],
    "sunColor": [0.0, 0.0, 0.0],
    "skyColor": [0.05, 0.06, 0.10],
    "groundColor": [0.02, 0.02, 0.03],
    "fogColor": [0.05, 0.028, 0.022],
    "shadows": false,
    "glow": { "strength": 0.9, "threshold": 0.6 }
  },
  "sky": { "panorama": "Sky/night_sky.png", "intensity": 1.0 },
  "outdoor": true,
  "audio": {
    "beds": [
      { "sound": "wind", "gain": 0.35 },
      { "sound": "drone", "gain": 0.2 }
    ]
  },
  "particles": { "leaves": false, "fogBanks": true },
  "unease": { "figure": false },
  "halos": [
    { "position": [-0.75, 4.35, 12.0], "size": 1.5, "color": [1.0, 0.78, 0.5], "intensity": 0.3 },
    { "position": [-0.75, 4.35, 4.0], "size": 1.5, "color": [1.0, 0.78, 0.5], "intensity": 0.3 },
    { "position": [-0.75, 4.35, -4.0], "size": 1.5, "color": [1.0, 0.78, 0.5], "intensity": 0.3, "flicker": 0.8 },
    { "position": [-0.75, 4.35, -12.0], "size": 1.5, "color": [1.0, 0.78, 0.5], "intensity": 0.3 },
    { "position": [3.0, 2.05, 8.0], "size": 3.0, "color": [1.0, 0.3, 0.6], "intensity": 0.5 },
    { "position": [-3.5, 2.05, -1.0], "size": 3.0, "color": [0.3, 0.8, 1.0], "intensity": 0.5, "flicker": 0.5 }
  ],
  "entities": [
    { "name": "lamp_1", "position": [-1.8, 0.0, 12.0], "model": "Kit/street_lamp.glb" },
    { "name": "lamp_2", "position": [-1.8, 0.0, 4.0], "model": "Kit/street_lamp.glb" },
    { "name": "lamp_3", "position": [-1.8, 0.0, -4.0], "model": "Kit/street_lamp.glb" },
    { "name": "lamp_4", "position": [-1.8, 0.0, -12.0], "model": "Kit/street_lamp.glb" },
    { "name": "sign_pink", "position": [3.0, 0.0, 8.0], "model": "Kit/neon_sign.glb" },
    { "name": "sign_cyan", "position": [-3.5, 0.0, -1.0], "model": "Kit/neon_sign.glb" }
  ]
}
